author,statement,source,date,target
Ciara O'Rourke,“U.S. military arrests Michael Sussmann.”,Facebook posts,"June 10, 2022",pants-fire
Samantha Putterman,The official pride flag was altered to include Ukrainian colors.,Tweets,"June 10, 2022",false
Ciara O'Rourke,A “public health warning” was recently issued for fluoride toothpaste.,Facebook posts,"June 10, 2022",false
Andy Nguyen,"""Gavin Newsom reportedly intervened at the request of Nancy Pelosi and directly ordered the California Highway Patrol to drop all charges"" against Paul Pelosi for his DUI arrest.",Instagram posts,"June 10, 2022",false
Ciara O'Rourke,Joe Biden approved a “new card” that “gives free health insurance to Americans” who are 25 and older.,Facebook posts,"June 10, 2022",false
Laura Schulte,"""Nearly 60% of all student loan debt is held by the rich and upper-middle class,"" so forgiveness would give the wealthy a ""financial windfall"" but not really help low-income people.",Glenn Grothman,"June 10, 2022",half-true
Louis Jacobson,“Bennie Thompson objected to the 2004 Presidential election.”,House Republican Conference,"June 10, 2022",mostly-true
Samantha Putterman,"The Jan. 6, 2021, attack on the U.S. Capitol “was a dust-up.”",Jack Del Rio,"June 9, 2022",false
Ciara O'Rourke,"Baby boomers didn’t have autism, seizures, allergies and other ailments when they were kids.",Facebook posts,"June 9, 2022",barely-true
Ciara O'Rourke,Ray Liotta died because of the COVID-19 vaccine.,Tweets,"June 9, 2022",pants-fire
Ciara O'Rourke,Says Barack Obama announced Joe Biden’s death.,Facebook posts,"June 9, 2022",pants-fire
Lyle Muller,“There are fewer Iowans working today than when Gov. Reynolds took office.”,Zach Wahls,"June 9, 2022",mostly-true
Ciara O'Rourke,Joe Biden resigned and “Trump is the new president.”,Facebook posts,"June 9, 2022",pants-fire
Warren Fiske,On building an NFL stadium in Virginia.,Chap Petersen,"June 9, 2022",full-flop
Jeff Cercone,"White supremacists are going to be “shooting up all Walmarts and will kill Blacks and Mexicans” in San Bernardino, California.",Instagram posts,"June 8, 2022",false
Monique Curet,“USDA is predicting egg prices will be $12 a dozen by fall 2022.”,Facebook posts,"June 8, 2022",false
Warren Fiske,“Public schools are now as segregated by race and class as they were in the 1960s.”,Bobby Scott,"June 8, 2022",mostly-true
Ciara O'Rourke,“U.S. Orders MILLIONS Of Smallpox Vaccines Amid Global Monkeypox Outbreak.”,Facebook posts,"June 8, 2022",half-true
Maria Ramirez,Ukraine adopted “laws banning the Russian language.”,Sergey Lavrov,"• June 8,",false
Samantha Putterman,Gun manufacturers are “the only industry in the country” that have immunity from lawsuits.,Joe Biden,"June 8, 2022",false
D.L. Davis,On disbanding the Wisconsin Elections Commission,Tim Michels,"June 8, 2022",full-flop
Monique Curet,BBC News edited out boos in footage of Boris Johnson arriving at the Queen’s Platinum Jubilee thanksgiving service.,Tweets,"June 7, 2022",false
Jeff Cercone,"""In Zimbabwe, people have started selling their toes for thousands of dollars due to (the) high cost of living.”",Facebook posts,"June 7, 2022",false
Gabrielle Settles,A BP oil executive named Brice Cromwell blamed the Biden administration for high gas prices.,Facebook posts,"June 7, 2022",pants-fire
Paul Specht,“The N.C. GOP came out in support of Sen. [Rick] Scott's extremist policy to ‘Rescue America.’”,Barbara Gaskins,"June 7, 2022",false
Madeline Heim,"""The tax carve out (Ron) Johnson spearheaded overwhelmingly benefited the wealthiest, over small businesses.""",Democratic Party of Wisconsin,"June 7, 2022",true
Paul Specht,Cheri Beasley tossed the conviction of a man seeking sex with a boy online and “set free” a child porn offender.,National Republican Senatorial Committee,"June 6, 2022",barely-true
Madison Czopek,"The sale of more than 600,000 Wisconsin deer licenses shows that Wisconsin’s hunters are the “eighth largest army in the world.”",Facebook posts,"June 6, 2022",false
Samantha Putterman,Biden gave Americans “the cheapest gas prices on Earth.”,Tweets,"June 6, 2022",false
Samantha Putterman,Video shows Ukrainian soldiers shooting down Russian helicopters.,Facebook posts,"June 6, 2022",false
Jon Greenberg,The U.S. Justice Department “conservatively estimated that guns are used 1.5 million times per year to save lives.”,Andy Biggs,"June 6, 2022",false
Jill Terreri,“The leading cause of death among children is a firearm.”,Charles Schumer,"• June 4,",mostly-true
Jill Terreri,Illinois high school to implement race-based grading system in 2022-2023 school year,Facebook posts,"• June 3,",false
Sara Swann,"With the $53 billion spent in Ukraine aid, the U.S. “could pay five SWAT members $80,000 each and have them at EVERY school front door.”",Facebook posts,"June 3, 2022",half-true
Madeline Heim,"""Our Supreme Court has never taken away a constitutional right.""",Tammy Baldwin,"June 3, 2022",false
Analisa Trofimuk,"""We need to realize that people who think that ‘well, maybe if we could just implement tougher gun laws, it’s going to solve it,’ Chicago and LA and New York disprove that thesis.""",Greg Abbott,"June 3, 2022",barely-true
Samantha Putterman,Speedway is offering $500 fuel cards for $1.95 to help customers with rising fuel costs.,Facebook posts,"June 2, 2022",pants-fire
Clara Hendrickson,"""Dead people always vote Democrat.""",Kevin Rinke,"June 2, 2022",false
Monique Curet,The World Economic Forum has its own police force.,Charlie Kirk,"June 2, 2022",false
Gabrielle Settles,Aaron Salter Jr. was killed by a mass shooter because he was working on creating a water-powered car engine.,Facebook posts,"June 2, 2022",false
Maria Ramirez,Increased encounters at the southwest border in April 2022 compared to April 2020 are attributable to changes in border policy.,Mark Brnovich,"• June 2,",barely-true
Samantha Putterman,A Costco gas pump screen said “Don’t blame us. Blame Joe Biden.”,Viral image,"June 1, 2022",false
Yacob Reyes,"""Florida man on drugs kills imaginary friend and turns himself in.”",Facebook posts,"June 1, 2022",pants-fire
Jeff Cercone,"""Pfizer CEO says it’s their dream to reduce the population by 50% in 2023.”",Bloggers,"June 1, 2022",pants-fire
Louis Jacobson,“Nobody in any election in America gets 74% of the votes. Ever. It doesn’t happen.”,Emerald Robinson,"June 1, 2022",pants-fire
Madison Czopek,"Active shooter drill at high school in Uvalde, Texas, two months before the elementary school shooting shows the event was a false flag.",Instagram posts,"May 31, 2022",pants-fire
Samantha Putterman,"The man who killed the Uvalde, Texas, school shooter “wasn't even an on-duty police officer.”",Facebook posts,"May 31, 2022",false
Jeff Cercone,TV interviews with two different men who are each identified as Uvalde victim's father show the Robb Elementary School mass shooting was staged.,Tweets,"May 31, 2022",false
Jill Terreri,Bill Gates planned a smallpox-type outbreak.,Facebook posts,"• May 31,",false
D.L. Davis,"In the immediate wake of a fire and vandalism at the Madison headquarters of an anti-abortion group, Democrats had not condemned “activists who are engaging in this repugnant illegal activity.”",Ron Johnson,"May 31, 2022",barely-true
Louis Jacobson,"In 2013, under a Democratic Senate, ""a majority of the Senate voted in favor of"" gun-related legislation sponsored by Republican Sens. Chuck Grassley and Ted Cruz, “but the Democrats filibustered it.”",Ted Cruz,"May 27, 2022",half-true
Samantha Putterman,“These mass shootings happen so much that Ted Cruz really got a template ready to tweet whenever they occur.”,Tweets,"May 27, 2022",false
Yacob Reyes,“There hasn't been a single of these mass shootings that have been purchased at a gun show or on the internet.”,Marco Rubio,"May 27, 2022",false
Ciara O'Rourke,Says Gov. Greg Abbott offered the uncle of a Uvalde shooting victim money to say “we don’t need stronger gun laws.”,Tweets,"May 27, 2022",pants-fire
Samantha Putterman,"CNN is recycling crisis actors in reports about a man dying in Afghanistan in 2021 and at the Uvalde, Texas, school shooting in 2022.",Facebook posts,"May 27, 2022",pants-fire
Gabrielle Settles,There’s a “‘positive correlation’ between higher mask usage and COVID-19 deaths.”,Facebook posts,"May 27, 2022",false
Lyle Muller,"“Zack Nunn saved over 2,000 Americans abandoned in Afghanistan by leading private rescue missions.”",Zach Nunn,"May 27, 2022",half-true
Jeff Cercone,"""More people die from hands, fists, feet, than rifles.”",Facebook posts,"May 27, 2022",mostly-true
Jill Terreri,Lee Zeldin “voted for Cuomo’s Billion Dollar Tax hike and every Cuomo budget.”,Harry Wilson,"• May 27,",half-true
Ciara O'Rourke,Video shows “Russian desert base and infrastructure hit by Bayraktar TB2 drone.”,Facebook posts,"May 26, 2022",false
Samantha Putterman,Studies show plastics can help combat climate change.,Facebook posts,"May 26, 2022",half-true
Gabrielle Settles,A CNN story reported that Rice Krispies added a transgender mascot.,Instagram posts,"May 26, 2022",pants-fire
Yacob Reyes,“Florida Highway Patrol has a semi-truck … The FHP uses a fleet of three such ‘hidden in plain sight’ trucks to snitch on bad drivers.”,Facebook posts,"May 26, 2022",mostly-true
Nusaiba Mizan,"ICE está en Uvalde, Texas, “entonces los padres indocumentados tienen que temer la deportación antes de verificar si sus hijos están vivos"".",Tweets,"May 26, 2022",false
Jeff Cercone,"They passed the flu off as COVID-19, and “they’re going to do the same thing with monkeypox and shingles.”",Facebook posts,"May 26, 2022",false
Madison Czopek,“We know from past experiences that the most effective tool for keeping kids safe is armed law enforcement on the campus.”,Ted Cruz,"May 26, 2022",false
Laura Schulte,On Gov. Tony “Evers’ watch…the efficiency of the state crime lab has plummeted.”,Republican Party of Wisconsin,"May 26, 2022",barely-true
Jon Greenberg,"""When we passed the assault weapons ban, mass shootings went down. When the law expired, mass shootings tripled.""",Joe Biden,"May 25, 2022",mostly-true
Samantha Putterman,"ABC News altered the Uvalde, Texas, school shooter’s photo to appear more Caucasian.",Tweets,"May 25, 2022",false
Ciara O'Rourke,"Texas is ""50th in the nation in mental health care access.""",Beto O'Rourke,"May 25, 2022",mostly-true
Nusaiba Mizan,"ICE is in Uvalde, Texas, “so undocumented parents have to consider arrest deportation before they go check to see if their kids are alive.”",Tweets,"May 25, 2022",false
Maria Ramirez,"This image shows the victims of the school shooting in Uvalde, Texas.",Facebook posts,"• May 25,",false
Monique Curet,Suggests a January traffic accident involving lab monkeys was responsible for spreading monkeypox to humans.,Facebook posts,"May 25, 2022",false
Amy Sherman,"“90% of Americans, regardless of political party, want universal background checks.”",Steve Kerr,"May 25, 2022",mostly-true
Tom Kertscher,"“50% of the guns sold in Texas, because of the loopholes, do not pass through a background check.”",Matthew Dowd,"May 25, 2022",false
Monique Curet,"El atacante en Uvalde, Texas estaba en Estados Unidos ilegalmente.",Facebook posts,"May 25, 2022",false
Paul Specht,Cheri Beasley “vacated” a man’s death sentence and “threw out” the indictment in a child assault case.,National Republican Senatorial Committee,"May 25, 2022",half-true
Louis Jacobson,"“Most of these killers tend to be 18, 19 years old.”",Chris Murphy,"May 25, 2022",mostly-true
Ciara O'Rourke,“They just exposed Mark Zuckerberg as a CIA agent.”,Facebook posts,"May 25, 2022",false
Ciara O'Rourke,"Photos of a person in a skirt show the Uvalde, Texas, school shooter.",Facebook posts,"May 25, 2022",false
Maria Ramirez,Esta imagen muestra a las víctimas del tiroteo en la escuela en Uvalde Texas.,Facebook posts,"• May 25,",false
Ciara O'Rourke,"The Uvalde, Texas, school shooter was a “transsexual leftist illegal alien named Salvatore Ramos.”",Facebook posts,"May 25, 2022",false
Monique Curet,“American journalist” Jack Posobiec was “arrested at World Economic Forum.”,Donald Trump Jr.,"May 25, 2022",false
Monique Curet,"The Uvalde, Texas, mass shooter was an “illegal alien.”",Facebook posts,"May 25, 2022",false
Madison Czopek,“Swedish health authorities considering introducing restrictions because of monkeypox outbreak.”,Facebook posts,"May 25, 2022",false
Ciara O'Rourke,"The shooting at an elementary school in Uvalde County, Texas, was a false flag.",Tweets,"May 24, 2022",pants-fire
Monique Curet,The current monkeypox outbreak was planned by government and industry leaders.,Facebook posts,"May 24, 2022",false
Jon Greenberg,“J.D. Vance profits off Russia propaganda.”,Tim Ryan,"May 24, 2022",half-true
Ciara O'Rourke,Monkeypox “was created in a lab and given via injection.”,Facebook posts,"May 24, 2022",false
Ciara O'Rourke,Monkeypox is biological warfare “against us by our governments.”,Facebook posts,"May 24, 2022",false
Sara Swann,The United States can’t import baby formula because of the U.S.-Mexico-Canada Agreement.,Facebook posts,"May 24, 2022",barely-true
Ciara O'Rourke,“Bill Gates is behind the monkeypox outbreaks.”,Facebook posts,"May 24, 2022",pants-fire
Monique Curet,"The World Health Assembly was canceled ""after the Geneva airport was coincidentally blown up.""",Facebook posts,"May 24, 2022",false
Louis Jacobson,"Stacey Abrams ""supported the MLB boycott.""",Chris Carr,"May 24, 2022",false
Vanessa Swales,"In a recent year, the Milwaukee Police Department ""collected more guns per capita off the streets than in New York.”",Cavalier Johnson,"May 24, 2022",true
Samantha Putterman,"A Mars Rover photo captured by NASA shows a doorway, suggesting extraterrestrial life.",Facebook posts,"May 23, 2022",false
Ciara O'Rourke,Video shows a “Russian pilot” escaping from jets and a Russian aircraft getting hit by a missile.,Viral image,"May 23, 2022",false
Amy Sherman,Georgia Gov. Brian Kemp “allowed 7.5 million ballots to be sent to every registered voter.”,David Perdue,"May 23, 2022",false
Louis Jacobson,"In 2020, when Raphael Warnock ran a campaign ad featuring himself with a beagle, “that wasn’t his dog.”",Gary Black,"May 23, 2022",true
Ciara O'Rourke,A 2021 article about monkeypox that used a photo of a shingles rash proves the monkeypox virus is a hoax.,Facebook posts,"May 23, 2022",false
Monique Curet,"“Americans can get up to $50k in relief” from a “new benefit that just got released last week.""",Facebook posts,"May 23, 2022",pants-fire
Ciara O'Rourke,Photos of monkeypox lesions prove the current virus outbreak is a hoax.,Facebook posts,"May 23, 2022",false
Warren Fiske,Merrick Garland “sicced the police on parents when they were at the school boards simply trying to be heard for the safety of their children.”,Winsome Earle-Sears,"May 23, 2022",false
Ciara O'Rourke,"“Indiana woman charged for mail in voter fraud, delivered 400 ballots with Democrat box pre-checked.”",Viral image,"May 20, 2022",half-true
Samantha Putterman,"Supreme Court Justice Clarence Thomas and his wife Ginni posted a photo of themselves enjoying a $5,135 bottle of wine “as American women despair about abortion rights being taken away from them.”",Tweets,"May 20, 2022",false
Ciara O'Rourke,Video shows helicopters in Ukraine “being picked off in ambush - Short range air-to-air missile”,Facebook posts,"May 20, 2022",false
Ciara O'Rourke,Video shows “Russian tank column totally destroyed by attack helicopter.”,Facebook posts,"May 20, 2022",false
D.L. Davis,Says Gov. Tony Evers is “a big proponent of this defund the police movement.”,Rebecca Kleefisch,"May 20, 2022",false
Tom Kertscher,"""David Perdue voted with liberals” for $10 trillion “in new debt, his out-of-control federal spending is driving inflation through the roof.""",Brian Kemp,"May 19, 2022",barely-true
Madison Czopek,Says Fox News and Candace Owens tweeted that “New studies show that 68% of those who used ivermectin to treat or prevent covid are suffering long-term bowel and urinary incontinence.”,Facebook posts,"May 19, 2022",false
Monique Curet,"“(Pfizer) says do not breastfeed. Baby formula shortages everywhere. Gates promotes brand new artificial breast milk technology. All within less than a 2 week period. …Nothing to see here.""",Facebook posts,"May 19, 2022",false
Monique Curet,“Don't let this formula shortage scare you!!! Make your baby some hemp milk w/sea moss. It’s easy I promise!”,Facebook posts,"May 19, 2022",false
Ciara O'Rourke,A photo of Ukrainians with paintball guns proves the war is staged.,Viral image,"May 19, 2022",pants-fire
Amy Sherman,"Georgia Secretary of State Brad Raffensperger used ""$50 million of Zuckerberg money"" in 2020 to ""tip the scales.""",Jody Hice,"May 19, 2022",false
Monique Curet,"""In Iran, if a 12-year-old girl is raped and impregnated by her father, she must carry the baby to term, or be thrown in prison for life. Wait, sorry, no, That's Alabama.""",Instagram posts,"May 19, 2022",false
Louis Jacobson,Agriculture “is still the No. 1 sector of the economy” in Georgia.,Gary Black,"May 19, 2022",false
Ciara O'Rourke,"Students in Wilkes County, North Carolina, “identify themselves as cats or ‘furries’” and “have asked for litter boxes to be placed in school restrooms for them to use.”",Facebook posts,"May 19, 2022",pants-fire
Jon Greenberg,“The Biden administration is bringing amendments that would propose that all nations of the earth cede their sovereignty over national health care decisions to the WHO.”,Michele Bachmann,"May 19, 2022",false
Ciara O'Rourke,"News interview proves that the Buffalo, New York supermarket shooting was staged.",Instagram posts,"May 19, 2022",pants-fire
Ciara O'Rourke,“Soldiers destroyed Russian tank with NLAW in ambush.”,Viral image,"May 19, 2022",false
Madison Czopek,The U.S. government’s inaction over buffalo killing that harmed Native American populations in the 1800s shows it is now “is creating food shortages” so that Americans are more “dependent on the government.”,Facebook posts,"May 19, 2022",false
Nusaiba Mizan,"""Under Greg Abbott, property taxes have gone up $20 billion.""",Beto O'Rourke,"May 19, 2022",mostly-true
Ciara O'Rourke,Goat’s milk is a good substitute for baby formula.,Facebook posts,"May 19, 2022",false
Ciara O'Rourke,“Breaking: Democrats introduce bill to put Americans in quarantine camps.”,Bloggers,"May 18, 2022",pants-fire
Monique Curet,“Due to the baby formula shortage Tricare will now pay to have it shipped directly to you.”,Facebook posts,"May 18, 2022",half-true
Amy Sherman,The problem with mail ballots in Lancaster County is a sign of “voter fraud.”,Tweets,"May 18, 2022",false
Ciara O'Rourke,Photo from “data leak at Elon Musk AND NASA … are said to be from one of Elon Musk’s Space-X satellites.”,Viral image,"May 18, 2022",false
Ciara O'Rourke,"CBS News reported that two more suspects were arrested in the Buffalo shooting, and that one more victim was identified.",Viral image,"May 18, 2022",false
Samantha Putterman,"“79% of Planned Parenthood clinics are in minority neighborhoods. This is not by accident. That is by its founder, Margaret Sanger's, eugenicist design.""",Candace Owens,"May 18, 2022",barely-true
Ciara O'Rourke,A recent photo shows the “Russian Orthodox Church blessing a rocket called Satan.”,Facebook posts,"May 18, 2022",false
Gabrielle Settles,"The mass shooting in Buffalo, New York was a “false flag event.”",Tweets,"May 18, 2022",pants-fire
Maria Ramirez,“The vast majority of individuals that we’re releasing out are not showing up for hearings.”,James Lankford,"• May 17,",false
Ciara O'Rourke,Your state will send you free infant formula if you call Enfamil and Similac customer service numbers.,Facebook posts,"May 17, 2022",false
Ciara O'Rourke,Amazon will ship baby formula to U.S. addresses if you change your preferred country on its website from the U.S. to Canada.,Facebook posts,"May 17, 2022",barely-true
Bill McCarthy,"A reporter who covered the Buffalo supermarket shooting was a ""crisis actor.""",Instagram posts,"May 17, 2022",pants-fire
Monique Curet,Donations of baby formula to Ukraine helped cause the current U.S. shortage.,Facebook posts,"May 17, 2022",false
Louis Jacobson,"“When unemployment goes down, inflation goes up.”",Nancy Pelosi,"May 17, 2022",barely-true
Ciara O'Rourke,Images show Joe Biden surrounded by U.S. Marshals.,Facebook posts,"May 17, 2022",false
Ciara O'Rourke,Mark Zuckerberg was arrested.,Facebook posts,"May 17, 2022",pants-fire
Yacob Reyes,"“Disney stock is down more than 70% and attendance is down more than 55%! 10.1 million people canceled their Disney+ subscription.""",Facebook posts,"May 17, 2022",false
Ciara O'Rourke,No planes are visible in footage of the 9/11 attack.,Viral image,"May 17, 2022",pants-fire
Tom Kertscher,"Kathy Barnette ""pretends she's America First, but repeatedly attacked President Trump.""",Our American Century,"May 17, 2022",half-true
Laura Schulte,"“Title 42 has fueled the border crisis. In 2019, 7 percent of illegal border crossings were repeated crossings. Today the rate is 27 percent.”",Tom Nelson,"May 17, 2022",half-true
Jon Greenberg,“Democrats want open borders so they can bring in and amnesty tens of millions of illegal aliens — that’s their electoral strategy.”,Blake Masters,"May 16, 2022",false
Tom Kertscher,Says she never tweeted comments linking pedophilia and Islam.,Kathy Barnette,"May 16, 2022",pants-fire
Madison Czopek,"“We have 76% of Americans living paycheck to paycheck, meaning they are one paycheck away from poverty.”",Facebook posts,"May 16, 2022",barely-true
Monique Curet,Suggests Megan Thee Stallion was not shot in the foot.,Facebook posts,"May 16, 2022",false
Ciara O'Rourke,“Finland joins NATO.”,Facebook posts,"May 16, 2022",barely-true
Gabrielle Settles,The NewProfilePic app is Russian spyware.,Facebook posts,"May 16, 2022",false
Paul Specht,"State Sen. Kirk deViere voted against Medicaid expansion, the governor’s budget and teacher raises.",North Carolina Futures Action Fund,"May 16, 2022",false
Louis Jacobson,“When President Biden took office … there was no vaccine available.”,Joe Biden,"May 16, 2022",false
Ciara O'Rourke,“Your government quietly confirmed the fully vaccinated are developing Acquired Immunodeficiency Syndrome.”,Viral image,"May 16, 2022",pants-fire
Ciara O'Rourke,Photos of the alleged Buffalo shooting gunman show two different people.,Facebook posts,"May 16, 2022",pants-fire
Yacob Reyes,“It costs more to live in many Florida cities than New York City.”,Charlie Crist,"May 16, 2022",half-true
Jon Greenberg,"“Kathy Barnette wants to build a statue of Barack Obama right next to the one of Abraham Lincoln on Capitol Hill.""",USA Freedom Fund,"May 13, 2022",mostly-true
Madison Czopek,Says the Biden administration is choosing to send baby formula to the border as one of its “out-of-touch priorities.”,Greg Abbott,"May 13, 2022",barely-true
Louis Jacobson,Joe Biden “inherited inflation of 1.7%. Now we're well over 8% and growing.”,Kathy Barnette,"May 13, 2022",mostly-true
Monique Curet,Homemade baby formula recipes offer a ‘viable option’ during U.S. shortage,Facebook posts,"May 13, 2022",false
Jon Greenberg,“We’re one of the seven nations in the world that allow abortion on demand at 20 weeks.”,Lindsey Graham,"May 13, 2022",half-true
Louis Jacobson,“Agriculture is the No. 1 industry here in Pennsylvania.”,Kathy Barnette,"May 13, 2022",false
Louis Jacobson,"“My Treasury Department is planning to pay down the national debt this quarter, which never happened under my predecessor.”",Joe Biden,"May 13, 2022",half-true
Monique Curet,Says people can follow a 1960 recipe for homemade baby formula as a workaround during the current shortage.,Facebook posts,"May 13, 2022",false
Alan Hovorka,"The Biden administration has been ""recklessly releasing potentially dangerous Afghans into our communities.""",Tom Tiffany,"May 13, 2022",barely-true
Monique Curet,Suggests Amber Heard snorted cocaine while on the stand in court.,Facebook posts,"May 12, 2022",pants-fire
Samantha Putterman,The infant formula shortage was purposely created because Mark Zuckerberg and Bill Gates invested in artificial breast milk.,Facebook posts,"May 12, 2022",false
Tom Kertscher,"""Kari Lake has been appearing at rallies with neo-Nazis,"" while ""two federal juries have found"" Katie Hobbs ""guilty of racial discrimination.""",Aaron Lieberman,"May 12, 2022",barely-true
Yacob Reyes,"“Is ANYONE asking how Ron DeSantis was worth $340,000 in 2020 and is now worth $52 million?""",Tweets,"May 12, 2022",false
Gabrielle Settles,"An adenovirus is a combination of viruses, gastrointestinal virus, pneumonia and COVID-19 mixed together to “kill our children.”",Facebook posts,"May 12, 2022",false
Warren Fiske,“CO2 is not a pollutant.”,Suburban Virginia Republican Coalition,"May 12, 2022",false
Samantha Putterman,Supreme Court Justices Amy Coney Barrett and Samuel Alito said that the U.S. needs a “domestic supply of infants” to meet the needs of parents seeking to adopt.,Facebook posts,"May 12, 2022",false
Monique Curet,"Says photo shows ""one of Tesla's lithium supply mines where entire mountains are eliminated.""",Facebook posts,"May 11, 2022",false
D.L. Davis,"Due to U.S. Senate rules, Democrats need ""more than a majority ... to codify Roe vs. Wade.""",Kelda Helen Roys,"May 11, 2022",true
